{
  "coverage": {
    "availableFunctions": 32,
    "selectedFunctions": 32,
    "selectedTypes": 16,
    "unresolvedSelected": [],
    "unselectedHeaderFunctions": [
      "cuArray3DCreate_v2",
      "cuArray3DGetDescriptor_v2",
      "cuArrayCreate_v2",
      "cuArrayDestroy",
      "cuArrayGetDescriptor_v2",
      "cuArrayGetMemoryRequirements",
      "cuArrayGetPlane",
      "cuArrayGetSparseProperties",
      "cuCheckpointProcessCheckpoint",
      "cuCheckpointProcessGetRestoreThreadId",
      "cuCheckpointProcessGetState",
      "cuCheckpointProcessLock",
      "cuCheckpointProcessRestore",
      "cuCheckpointProcessUnlock",
      "cuCoredumpDeregisterCompleteCallback",
      "cuCoredumpDeregisterStartCallback",
      "cuCoredumpGetAttribute",
      "cuCoredumpGetAttributeGlobal",
      "cuCoredumpRegisterCompleteCallback",
      "cuCoredumpRegisterStartCallback",
      "cuCoredumpSetAttribute",
      "cuCoredumpSetAttributeGlobal",
      "cuCtxAttach",
      "cuCtxDetach",
      "cuCtxDisablePeerAccess",
      "cuCtxEnablePeerAccess",
      "cuCtxFromGreenCtx",
      "cuCtxGetApiVersion",
      "cuCtxGetCacheConfig",
      "cuCtxGetDevResource",
      "cuCtxGetDevice",
      "cuCtxGetDevice_v2",
      "cuCtxGetExecAffinity",
      "cuCtxGetFlags",
      "cuCtxGetId",
      "cuCtxGetLimit",
      "cuCtxGetSharedMemConfig",
      "cuCtxGetStreamPriorityRange",
      "cuCtxPopCurrent_v2",
      "cuCtxPushCurrent_v2",
      "cuCtxRecordEvent",
      "cuCtxResetPersistingL2Cache",
      "cuCtxSetCacheConfig",
      "cuCtxSetFlags",
      "cuCtxSetLimit",
      "cuCtxSetSharedMemConfig",
      "cuCtxSynchronize",
      "cuCtxSynchronize_v2",
      "cuCtxWaitEvent",
      "cuDestroyExternalMemory",
      "cuDestroyExternalSemaphore",
      "cuDevResourceGenerateDesc",
      "cuDevSmResourceSplit",
      "cuDevSmResourceSplitByCount",
      "cuDeviceCanAccessPeer",
      "cuDeviceComputeCapability",
      "cuDeviceGetByPCIBusId",
      "cuDeviceGetDefaultMemPool",
      "cuDeviceGetDevResource",
      "cuDeviceGetExecAffinitySupport",
      "cuDeviceGetGraphMemAttribute",
      "cuDeviceGetHostAtomicCapabilities",
      "cuDeviceGetLuid",
      "cuDeviceGetMemPool",
      "cuDeviceGetName",
      "cuDeviceGetNvSciSyncAttributes",
      "cuDeviceGetP2PAtomicCapabilities",
      "cuDeviceGetP2PAttribute",
      "cuDeviceGetPCIBusId",
      "cuDeviceGetProperties",
      "cuDeviceGetTexture1DLinearMaxWidth",
      "cuDeviceGetUuid_v2",
      "cuDeviceGraphMemTrim",
      "cuDevicePrimaryCtxGetState",
      "cuDevicePrimaryCtxRelease_v2",
      "cuDevicePrimaryCtxReset_v2",
      "cuDevicePrimaryCtxRetain",
      "cuDevicePrimaryCtxSetFlags_v2",
      "cuDeviceRegisterAsyncNotification",
      "cuDeviceSetGraphMemAttribute",
      "cuDeviceSetMemPool",
      "cuDeviceTotalMem_v2",
      "cuDeviceUnregisterAsyncNotification",
      "cuEventElapsedTime_v2",
      "cuEventRecordWithFlags",
      "cuEventSynchronize",
      "cuExternalMemoryGetMappedBuffer",
      "cuExternalMemoryGetMappedMipmappedArray",
      "cuFlushGPUDirectRDMAWrites",
      "cuFuncGetAttribute",
      "cuFuncGetModule",
      "cuFuncGetName",
      "cuFuncGetParamCount",
      "cuFuncGetParamInfo",
      "cuFuncIsLoaded",
      "cuFuncLoad",
      "cuFuncSetAttribute",
      "cuFuncSetBlockShape",
      "cuFuncSetCacheConfig",
      "cuFuncSetSharedMemConfig",
      "cuFuncSetSharedSize",
      "cuGetExportTable",
      "cuGraphAddBatchMemOpNode",
      "cuGraphAddChildGraphNode",
      "cuGraphAddDependencies_v2",
      "cuGraphAddEmptyNode",
      "cuGraphAddEventRecordNode",
      "cuGraphAddEventWaitNode",
      "cuGraphAddExternalSemaphoresSignalNode",
      "cuGraphAddExternalSemaphoresWaitNode",
      "cuGraphAddHostNode",
      "cuGraphAddKernelNode_v2",
      "cuGraphAddMemAllocNode",
      "cuGraphAddMemFreeNode",
      "cuGraphAddMemcpyNode",
      "cuGraphAddMemsetNode",
      "cuGraphAddNode_v2",
      "cuGraphBatchMemOpNodeGetParams",
      "cuGraphBatchMemOpNodeSetParams",
      "cuGraphChildGraphNodeGetGraph",
      "cuGraphClone",
      "cuGraphConditionalHandleCreate",
      "cuGraphCreate",
      "cuGraphDebugDotPrint",
      "cuGraphDestroy",
      "cuGraphDestroyNode",
      "cuGraphEventRecordNodeGetEvent",
      "cuGraphEventRecordNodeSetEvent",
      "cuGraphEventWaitNodeGetEvent",
      "cuGraphEventWaitNodeSetEvent",
      "cuGraphExecBatchMemOpNodeSetParams",
      "cuGraphExecChildGraphNodeSetParams",
      "cuGraphExecDestroy",
      "cuGraphExecEventRecordNodeSetEvent",
      "cuGraphExecEventWaitNodeSetEvent",
      "cuGraphExecExternalSemaphoresSignalNodeSetParams",
      "cuGraphExecExternalSemaphoresWaitNodeSetParams",
      "cuGraphExecGetFlags",
      "cuGraphExecGetId",
      "cuGraphExecHostNodeSetParams",
      "cuGraphExecKernelNodeSetParams_v2",
      "cuGraphExecMemcpyNodeSetParams",
      "cuGraphExecMemsetNodeSetParams",
      "cuGraphExecNodeSetParams",
      "cuGraphExecUpdate_v2",
      "cuGraphExternalSemaphoresSignalNodeGetParams",
      "cuGraphExternalSemaphoresSignalNodeSetParams",
      "cuGraphExternalSemaphoresWaitNodeGetParams",
      "cuGraphExternalSemaphoresWaitNodeSetParams",
      "cuGraphGetEdges_v2",
      "cuGraphGetId",
      "cuGraphGetNodes",
      "cuGraphGetRootNodes",
      "cuGraphHostNodeGetParams",
      "cuGraphHostNodeSetParams",
      "cuGraphInstantiateWithFlags",
      "cuGraphInstantiateWithParams",
      "cuGraphKernelNodeCopyAttributes",
      "cuGraphKernelNodeGetAttribute",
      "cuGraphKernelNodeGetParams_v2",
      "cuGraphKernelNodeSetAttribute",
      "cuGraphKernelNodeSetParams_v2",
      "cuGraphLaunch",
      "cuGraphMemAllocNodeGetParams",
      "cuGraphMemFreeNodeGetParams",
      "cuGraphMemcpyNodeGetParams",
      "cuGraphMemcpyNodeSetParams",
      "cuGraphMemsetNodeGetParams",
      "cuGraphMemsetNodeSetParams",
      "cuGraphNodeFindInClone",
      "cuGraphNodeGetContainingGraph",
      "cuGraphNodeGetDependencies_v2",
      "cuGraphNodeGetDependentNodes_v2",
      "cuGraphNodeGetEnabled",
      "cuGraphNodeGetLocalId",
      "cuGraphNodeGetParams",
      "cuGraphNodeGetToolsId",
      "cuGraphNodeGetType",
      "cuGraphNodeSetEnabled",
      "cuGraphNodeSetParams",
      "cuGraphReleaseUserObject",
      "cuGraphRemoveDependencies_v2",
      "cuGraphRetainUserObject",
      "cuGraphUpload",
      "cuGraphicsMapResources",
      "cuGraphicsResourceGetMappedMipmappedArray",
      "cuGraphicsResourceGetMappedPointer_v2",
      "cuGraphicsResourceSetMapFlags_v2",
      "cuGraphicsSubResourceGetMappedArray",
      "cuGraphicsUnmapResources",
      "cuGraphicsUnregisterResource",
      "cuGreenCtxCreate",
      "cuGreenCtxDestroy",
      "cuGreenCtxGetDevResource",
      "cuGreenCtxGetId",
      "cuGreenCtxRecordEvent",
      "cuGreenCtxStreamCreate",
      "cuGreenCtxWaitEvent",
      "cuImportExternalMemory",
      "cuImportExternalSemaphore",
      "cuIpcCloseMemHandle",
      "cuIpcGetEventHandle",
      "cuIpcGetMemHandle",
      "cuIpcOpenEventHandle",
      "cuIpcOpenMemHandle_v2",
      "cuKernelGetAttribute",
      "cuKernelGetFunction",
      "cuKernelGetLibrary",
      "cuKernelGetName",
      "cuKernelGetParamCount",
      "cuKernelGetParamInfo",
      "cuKernelSetAttribute",
      "cuKernelSetCacheConfig",
      "cuLaunch",
      "cuLaunchCooperativeKernel",
      "cuLaunchCooperativeKernelMultiDevice",
      "cuLaunchGrid",
      "cuLaunchGridAsync",
      "cuLaunchHostFunc",
      "cuLaunchHostFunc_v2",
      "cuLaunchKernel",
      "cuLibraryEnumerateKernels",
      "cuLibraryGetGlobal",
      "cuLibraryGetKernel",
      "cuLibraryGetKernelCount",
      "cuLibraryGetManaged",
      "cuLibraryGetModule",
      "cuLibraryGetUnifiedFunction",
      "cuLibraryLoadData",
      "cuLibraryLoadFromFile",
      "cuLibraryUnload",
      "cuLinkAddData_v2",
      "cuLinkAddFile_v2",
      "cuLinkComplete",
      "cuLinkCreate_v2",
      "cuLinkDestroy",
      "cuLogicalEndpointAddDevice",
      "cuLogicalEndpointBindAddr",
      "cuLogicalEndpointBindMem",
      "cuLogicalEndpointCreate",
      "cuLogicalEndpointDestroy",
      "cuLogicalEndpointExport",
      "cuLogicalEndpointGetLimits",
      "cuLogicalEndpointIdRelease",
      "cuLogicalEndpointIdReserve",
      "cuLogicalEndpointImport",
      "cuLogicalEndpointQuery",
      "cuLogicalEndpointUnbind",
      "cuLogsCurrent",
      "cuLogsDumpToFile",
      "cuLogsDumpToMemory",
      "cuLogsRegisterCallback",
      "cuLogsUnregisterCallback",
      "cuMemAddressFree",
      "cuMemAddressReserve",
      "cuMemAdvise_v2",
      "cuMemAllocAsync",
      "cuMemAllocFromPoolAsync",
      "cuMemAllocHost_v2",
      "cuMemAllocManaged",
      "cuMemAllocPitch_v2",
      "cuMemBatchDecompressAsync",
      "cuMemCreate",
      "cuMemDiscardAndPrefetchBatchAsync",
      "cuMemDiscardBatchAsync",
      "cuMemExportToShareableHandle",
      "cuMemFreeAsync",
      "cuMemGetAccess",
      "cuMemGetAddressRange_v2",
      "cuMemGetAllocationGranularity",
      "cuMemGetAllocationPropertiesFromHandle",
      "cuMemGetDefaultMemPool",
      "cuMemGetHandleForAddressRange",
      "cuMemGetMemPool",
      "cuMemHostGetDevicePointer_v2",
      "cuMemHostGetFlags",
      "cuMemHostRegister_v2",
      "cuMemHostUnregister",
      "cuMemImportFromShareableHandle",
      "cuMemMap",
      "cuMemMapArrayAsync",
      "cuMemPoolCreate",
      "cuMemPoolDestroy",
      "cuMemPoolExportPointer",
      "cuMemPoolExportToShareableHandle",
      "cuMemPoolGetAccess",
      "cuMemPoolGetAttribute",
      "cuMemPoolImportFromShareableHandle",
      "cuMemPoolImportPointer",
      "cuMemPoolSetAccess",
      "cuMemPoolSetAttribute",
      "cuMemPoolTrimTo",
      "cuMemPrefetchAsync_v2",
      "cuMemPrefetchBatchAsync",
      "cuMemRangeGetAttribute",
      "cuMemRangeGetAttributes",
      "cuMemRelease",
      "cuMemRetainAllocationHandle",
      "cuMemSetAccess",
      "cuMemSetMemPool",
      "cuMemUnmap",